{
  "theming": {
    "header": {
      "pageTitle": "My Company",
      "favicon": "https://www.mia-platform.eu/static/img/favicon/apple-icon-60x60.png"
    },
    "logo": {
      "alt": "My Company",
      "url_light_image": "https://avatars.githubusercontent.com/u/92730708?s=200&v=4",
      "url_dark_image": "https://raw.githubusercontent.com/lauragift21/giftegwuenu.dev/master/src/assets/img/logo-light.png",
      "navigation_url": "https://github.com/micro-lc"
    },
    "variables": {
      "primaryColor": "#4568B5"
    },
    "menuLocation": "topBar"
  },
  "plugins": [
    {
      "id": "plugin-test-2",
      "label": "Href same window",
      "icon": "far fa-window-maximize",
      "order": 2,
      "integrationMode": "href",
      "externalLink": {
        "url": "https://example.com/same-window",
        "sameWindow": true
      }
    }
  ],
  "analytics": {
    "privacyLink": "https://www.mia-platform.eu/img/Privacy_Policy_Website_EN.pdf",
    "disclaimer": "Questo sito utilizza cookie proprietari e di terze parti per assicurarti la migliore esperienza di navigazione. Per ulteriori informazioni, leggi la ",
    "gtmId": "GTM-000000"
  },
  "helpMenu": {
    "helpLink": "https://docs.mia-platform.eu/docs/business_suite/microlc/overview"
  },
  "rightMenu": [{
    "entry": "http://127.0.0.1:8080/wc-entry.esm.js",
    "tag": "wc-tag",
    "attributes": {
      "id": "your-wc-tag"
    }
  }],
  "internalPlugins": [
    {
      "id": "plugin-internal-test-4",
      "order": 5,
      "integrationMode": "iframe",
      "pluginRoute": "/internalPlugin1",
      "pluginUrl": "https://example.com/internal-plugin"
    }
  ]
}
